[
  {
    "id":"node-package",
    "relationshipType":"node",
    "required":[{"filename":"package.json"}],
    "optionalRoles":["lockfile","buildConfig"],
    "optionalFilenames":["package-lock.json","pnpm-lock.yaml","yarn.lock","bun.lock","tsconfig.json"],
    "minimumOptionalMatches":1,
    "confidence":0.95,
    "priority":78
  },
  {
    "id":"python-project",
    "relationshipType":"python",
    "requiredRoles":["manifest"],
    "requiredAnyFilenames":["pyproject.toml","requirements.txt","Pipfile","setup.py","setup.cfg"],
    "optionalRoles":["lockfile"],
    "optionalFilenames":["uv.lock","poetry.lock","Pipfile.lock"],
    "optionalDirectories":["src"],
    "minimumOptionalMatches":1,
    "confidence":0.93,
    "priority":77
  },
  {
    "id":"rust-package",
    "relationshipType":"rust",
    "required":[{"filename":"Cargo.toml"}],
    "optionalRoles":["lockfile"],
    "optionalFilenames":["Cargo.lock"],
    "optionalDirectories":["src"],
    "minimumOptionalMatches":1,
    "confidence":0.96,
    "priority":76
  },
  {
    "id":"go-module",
    "relationshipType":"go",
    "required":[{"filename":"go.mod"}],
    "optionalRoles":["lockfile"],
    "optionalFilenames":["go.sum"],
    "minimumOptionalMatches":1,
    "confidence":0.97,
    "priority":76
  },
  {
    "id":"docker-project",
    "relationshipType":"docker",
    "required":[{"filename":"Dockerfile"}],
    "requiredAnyFilenames":["compose.yml","compose.yaml","docker-compose.yml","docker-compose.yaml"],
    "optionalRoles":["sidecar"],
    "optionalFilenames":[".dockerignore"],
    "minimumOptionalMatches":0,
    "confidence":0.96,
    "priority":80
  }
]
